id,title,description,issued,modified,publisher
https://sede.agenciatributaria.gob.es/Sede/datosabiertos/catalogo/hacienda/Estadistica_del_IRPF_por_codigo_postal.shtml,Estadística de los declarantes del Impuesto sobre la Renta de las Personas Físicas de los mayores municipios por código postal | Estadística dels declarants de l'Impost sobre la Renda de les Persones Físiques dels municipis més grans per codi postal | Estatística dos declarantes do Imposto sobre a Renda das Persoas Físicas dos maiores municipios por código postal | Statistics of payers of Personal Income Tax by main municipalities by postcode,"Publicación Estadística de los declarantes de IRPF de los mayores municipios por código postal,  específicamente diseñada para proporcionar un mayor detalle de la renta bruta media y las magnitudes declaradas a nivel de distrito postal en los mayores municipios del territorio de régimen fiscal común (TRFC).
La distribución territorial de la población en España se caracteriza por la coexistencia de una elevada concentración en unos pocos grandes núcleos urbanos y una diseminación en núcleos rurales muy numerosos de grupos reducidos de habitantes. Esta circunstancia hace que la renta media puede ser muy distinta entre los diferentes barrios de un gran municipio.　
La selección de los municipios se ha hecho según tres criterios de los que ha de cumplirse al menos uno de ellos: tamaño de la población (más de 200.000 habitantes según el Censo de Población), tamaño fiscal (más de 100.000 declaraciones de IRPF en el ejercicio fiscal) y renta bruta total (tener una renta bruta agregada superior a los 2.200 millones de euros). En la mayoría de los casos los tres criterios se cumplen simultáneamente, pero hay unos pocos casos en los que es válido solo alguno de ellos.　
Si bien no se han definido variables de explotación distintas de las incluidas en la Estadística de declarantes de IRPF por municipios, sí que cambia la forma de presentación de algunas tablas, en particular de las dos primeras tablas. La primera incorpora el porcentaje de participación (representatividad) de las variables de cada uno de los mayores municipios en relación al total en TRFC, y en la segunda la comparación de los mayores municipios se establece respecto a su propia Comunidad Autónoma para las variables de explotación más significativas (índice declarativo, población, renta bruta media y renta disponible media).
","lun, 14 oct 2019 22:00:00 GMT+0000","mié, 08 oct 2025 22:00:00 GMT+0000",http://datos.gob.es/recurso/sector-publico/org/Organismo/EA0028512
https://opendata.euskadi.eus/catalogo/-/estadistica/tablas-estadisticas-del-aurrera-begira-indicadores-de-expectativas-juveniles-2024/,Aurrera Begira - Gazteen aurreikuspenei buruzko adierazleak 2024. Taula estatistikoak | Tablas estadísticas del Aurrera Begira - Indicadores de Expectativas Juveniles 2024,"Estadistica del Observatorio Vasco de la Juventud. Indicadores de Expectativas Juveniles 2024. | Gazteen Euskal Behatokiaren estatistika. Gazteen Itxaropenen Adierazleak 2024.Helburua da jakitea euskal gazteek nola hautematen duten oraina eta zer itxaropen dituzten etorkizunerako epe laburrean. Euskadiko gazteen egoera ebaluatzeko eta jarraipena egiteko tresna erraza eta sintetikoa da, 2013tik urtero egiten diren 10 adierazleren bidez. Egungo egoerari eta etorkizun hurbilari buruz gazteek duten pertzepzioan jartzen du arreta, bereziki enpleguan eta emantzipazioan.","mié, 14 may 2025 22:00:00 GMT+0000","dom, 14 sep 2025 22:00:00 GMT+0000",http://datos.gob.es/recurso/sector-publico/org/Organismo/A16003011
urn:ine:es:ODS:5320:18:251856,2030 Agenda SDG - Annual growth of Consumer Price Index (Identificador API: 18:251856) | Agenda 2030 ODS - Variación anual del Índice de Precios de Consumo (Identificador API: 18:251856),"ODS / Goals and targets (from the 2030 Agenda for Sustainable Development) / Goal 17. Strengthen the means of implementation and revitalize the global partnership for sustainable development / Target 17.13. Enhance global macroeconomic stability, including through policy coordination and policy coherence / Indicator 17.13.1. Macroeconomic Dashboard | ODS / Indicadores de la Agenda 2030 para el Desarrollo Sostenible / Objetivo 17. Fortalecer los medios de implementación y revitalizar la Alianza Mundial para el Desarrollo Sostenible /  Meta 17.13. Aumentar la estabilidad macroeconómica mundial, incluso mediante la coordinación y coherencia de las políticas / Indicador 17.13.1. Tablero macroeconómico","lun, 14 feb 2022 14:00:00 GMT+0000","vie, 29 ago 2025 09:00:00 GMT+0000",http://datos.gob.es/recurso/sector-publico/org/Organismo/EA0010587
https://datos.madrid.es/egob/catalogo/200186-0-polideportivos,Deportes. Centros Deportivos Municipales (Polideportivos),"En la Ciudad de Madrid, existen diversas instalaciones para la práctica deportiva y que son de propiedad municipal. Principalmente están:  los Centros Deportivos Municipales (Polideportivos)   que existen del orden de 70 actualmente, distribuidos por los distintos barrios, y en los cuales se pueden practicar distintos deportes y las  Instalaciones Básicas,  que existen del orden de 475. Estas últimas suelen ser de uso libre, y suele ser para la práctica de un deporte (por ejemplo, una pista de futbol o baloncesto)   En este mismo portal, tiene el conjunto de datos:   Deportes: Instalaciones Deportivas Básicas Municipales     En los ficheros que hay más abajo, tiene datos de ubicación, transporte, contacto, horario, servicios, superficies disponibles de las instalaciones municipales deportivas básicas. Cada una de ellas se ubica y referencia espacialmente.     En  el apartado 'Documentación asociada', hay un documento con la estructura del fichero y  las recomendaciones y/o advertencias, que le permitirá usar y comprender mejor los datos.    También puede  consultar la relación existente  en la web municipal  www.madrid.es  para ver la ficha asociada a cada instalación.   A través del Portal de Visualizaciones ' Visualiza Madrid con Datos Abiertos' , el Ayuntamiento de Madrid pone a tu disposición una visualización en la que se muestran datos sobre Centros Deportivos Municipales (Polideportivos).           Acceder a la visualización de datos de los Centros Deportivos Municipales en el Portal de datos abiertos     Fuente:  www.madrid.es","mar, 11 mar 2014 23:00:00 GMT+0000","vie, 22 ago 2025 22:55:40 GMT+0000",http://datos.gob.es/recurso/sector-publico/org/Organismo/L01280796
https://datos.madrid.es/egob/catalogo/200149-0-oficinas-linea-madrid,Oficinas de Línea Madrid,"Línea Madrid es la marca que identifica la atención al ciudadano dentro de Ayuntamiento de Madrid, integrando los distintos medios y canales existentes para relacionarse con el Ayuntamiento. Estos canales son en la actualidad el telefónico (teléfono 010), el presencial (red de oficinas Línea Madrid) y los dos canales de Internet: la página web www.madrid.es y la cuenta de  Twitter  @Lineamadrid.  En este conjunto de datos se presenta la relación de oficinas presenciales, que complementan a la atención telefónica y la atención via  Twitter.  No hay que confundir las oficinas de Linea Madrid con las oficinas de atención al contribuyente. Estas últimas (son 5 y no están incluidas en este conjunto de datos) son las oficinas que presenta la Agencia Tributaria del Ayuntamiento de Madrid para la atención ciudadana con respecto a impuestos, tributos, tasas, ... etc.       Fuente:     www.madrid.es","mar, 11 mar 2014 23:00:00 GMT+0000","vie, 22 ago 2025 22:55:40 GMT+0000",http://datos.gob.es/recurso/sector-publico/org/Organismo/L01280796
https://datos.madrid.es/egob/catalogo/200304-0-centros-culturales,Centros Culturales Municipales (incluyen Socioculturales y Juveniles),"Este conjunto de datos incluye los  Centros Culturales , los  Socioculturales  y los  Juveniles  del Ayuntamiento de Madrid (incluídos aquellos en los que el Ayuntamiento es miembro del consorcio titular). También están incluidas las Salas de Estudio y Lectura.   El fichero contiene los datos de localización (dirección, distrito y barrio), contacto, horario, servicios y actividades tipo que se pueden celebrar.   Existe en el portal otro conjunto de datos relacionado como es:  Actividades Culturales y de Ocio Municipal en los próximos 100 días , donde se incluyen la programación de actividades culturales que hay en la ciudad, y que incluye las celebradas en Centros Culturales, los Socioculturales, los Juveniles, las Bibliotecas, etc.    En  el apartado 'Documentación asociada', hay un documento con la estructura del fichero y  las recomendaciones sobre el uso de los datos.    A través del Portal de Visualizaciones ' Visualiza Madrid con Datos Abiertos' , el Ayuntamiento de Madrid pone a tu disposición una visualización acerca del Catálogo de Datos Abiertos del Ayuntamiento de Madrid, en la que se muestran datos sobre Centros Culturales Municipales.           Acceder a la visualización       Fuente:  www.madrid.es","mar, 11 mar 2014 23:00:00 GMT+0000","vie, 22 ago 2025 22:55:39 GMT+0000",http://datos.gob.es/recurso/sector-publico/org/Organismo/L01280796
https://datos.madrid.es/egob/catalogo/200342-0-centros-dia,Centros de Día,"Centros día municipales y concertados de la ciudad de Madrid.   Los  centros de día  son instalaciones especializadas en personas mayores, donde un grupo de profesionales se dedica a la prevención, tratamiento y cuidado de las personas mayores. Los mayores pueden continuar en sus casas, pasando las noches y fines de semana, de este modo no existe una desvinculación total con su ambiente de referencia, su entorno, ya que no se encuentran en situaciones de total dependencia.   A través del Portal de Visualizaciones ' Visualiza Madrid con Datos Abiertos' , el Ayuntamiento de Madrid pone a tu disposición una visualización acerca del Catálogo de Datos Abiertos del Ayuntamiento de Madrid, en la que se muestran datos sobre Centros de Día.            Acceder a la visualización de datos       Fuente:  www.madrid.es","mar, 11 mar 2014 23:00:00 GMT+0000","vie, 22 ago 2025 22:55:39 GMT+0000",http://datos.gob.es/recurso/sector-publico/org/Organismo/L01280796
https://datos.madrid.es/egob/catalogo/200337-0-centros-mayores,Centros Municipales de Mayores,"Relación de los Centros de Mayores de titularidad municipal de la ciudad de Madrid.   Los  Centros Municipales de Mayores  son espacios donde se realizan actividades de prevención de la dependencia y promoción del ocio y envejecimiento activo, con el fin de mejorar la calidad de vida de las personas mayores.   Se incluye una pormenorizada relación de los servicios e instalaciones que se proporcionan en cada centro.   A través del Portal de Visualizaciones ' Visualiza Madrid con Datos Abiertos' , el Ayuntamiento de Madrid pone a tu disposición una visualización acerca del Catálogo de Datos Abiertos del Ayuntamiento de Madrid, en la que se muestran datos sobre Centros de Municipales de Mayores.          Acceder a la visualización de Algunos ejemplos de datos disponibles en el Portal de datos abiertos        Fuente:  www.madrid.es","mar, 11 mar 2014 23:00:00 GMT+0000","vie, 22 ago 2025 22:55:39 GMT+0000",http://datos.gob.es/recurso/sector-publico/org/Organismo/L01280796
https://datos.madrid.es/egob/catalogo/200215-0-instalaciones-deportivas,Deportes. Instalaciones Deportivas Básicas Municipales,"En la Ciudad de Madrid existen diversas instalaciones para la práctica deportiva que son de propiedad municipal. Principalmente están:  los Centros Deportivos Municipales (Polideportivos)  que existen del orden de 70 actualmente, distribuidos por los distintos barrios, y en los cuales se pueden practicar distintos deportes y las  Instalaciones Básicas,  que existen del orden de 475. Estas últimas suelen ser de uso libre y para la práctica de un deporte (por ejemplo, una pista de futbol o baloncesto).   En este mismo portal tiene el conjunto de datos:  Deportes: Centros Deportivos Municipales (Polideportivos)    En los ficheros que hay más abajo, tiene datos de ubicación, transporte, contacto, horario, servicios, superficies disponibles de las instalaciones municipales deportivas básicas. Cada una de ellas se ubica y referencia espacialmente.    En  el apartado 'Documentación asociada', hay un documento con la estructura del fichero y  las recomendaciones y/o advertencias, que le permitirá usar y comprender mejor los datos.    También puede  consultar la relación existente  en la web municipal  www.madrid.es  para ver la ficha asociada a cada instalación.   A través del Portal de Visualizaciones ' Visualiza Madrid con Datos Abiertos' , el Ayuntamiento de Madrid pone a tu disposición una visualización, en la que se muestran datos sobre Instalaciones Deportivas Básicas Municipales.           Acceder a la visualización de los datos sobre instalaciones deportivas básicas municipales disponibles en el Portal de datos abiertos     Fuente:  www.madrid.es","mar, 11 mar 2014 23:00:00 GMT+0000","vie, 22 ago 2025 22:55:39 GMT+0000",http://datos.gob.es/recurso/sector-publico/org/Organismo/L01280796
https://datos.madrid.es/egob/catalogo/200967-0-mercados,Mercados municipales,"Los mercados municipales constituyen un servicio público profundamente arraigado en la cultura de los madrileños; mantienen una relevante función como referentes del comercio tradicional de alimentos frescos y de la vida social de los barrios.   Se relacionan los 46 mercados que conforman la red municipal, aportando datos de:     dirección   contacto   horarios   transportes   servicios   coordenadas para su localización sobre plano     Este conjunto de datos, complementa a otro publicado en este portal que es 'Mercados Municipales: locales comerciales, nombres comerciales y actividades', donde esta la información de locales comerciales, actividad, nombre comercial y planta o ubicación.   A través del Portal de Visualizaciones ' Visualiza Madrid con Datos Abiertos' , el Ayuntamiento de Madrid pone a tu disposición una visualización acerca del Catálogo de Datos Abiertos del Ayuntamiento de Madrid, en la que se muestran datos sobre Mercados Municipales.          Acceder a la visualización.      Fuente:     www.madrid.es","mar, 11 mar 2014 23:00:00 GMT+0000","vie, 22 ago 2025 22:55:39 GMT+0000",http://datos.gob.es/recurso/sector-publico/org/Organismo/L01280796
https://datos.madrid.es/egob/catalogo/201132-0-museos,Museos de la ciudad de Madrid,"Relación de los museos de la ciudad de Madrid, de titularidad tanto pública como privada, incluyendo su descripción, datos de localización, medios de transporte cercanos, horario, datos de contacto, página web o coordenadas para su georreferenciación. Se incluyen los Museos Municipales del Ayuntamiento de Madrid, relacionados en el siguiente enlace:  www.madrid.es/museos  y a los que se puede seguir a través de las siguientes redes sociales:   - Twitter:  @museos demadrid  - YouTube:  https://www.youtube.com/channel/UCa-23HjOPgxgd842RUFml0A      Fuente:     www.madrid.es","mar, 11 mar 2014 23:00:00 GMT+0000","vie, 22 ago 2025 22:55:39 GMT+0000",http://datos.gob.es/recurso/sector-publico/org/Organismo/L01280796
https://datos.madrid.es/egob/catalogo/200761-0-parques-jardines,Principales parques y jardines municipales,"Madrid ofrece un patrimonio verde de excepcional extensión y diversidad (más de 6.000 hectáreas, que suponen más de 18 metros cuadrados de parques y zonas verdes públicas por habitante de la ciudad).   La relación siguiente corresponde a los principales parques y zonas verdes de Madrid cuya conservación corresponde al Ayuntamiento de Madrid, con sus características detalladas. En el listado se incluyen tanto jardines y pequeñas zonas verdes, como los clasificados como parques históricos, singulares o forestales, así como las rosaledas y colecciones botánicas. Conviene aclarar que esta información corresponde a los parques y jardines más significativos de cada distrito, pero no a todas las zonas verdes, ya que existen también multitud de pequeños espacios verdes, medianas, rotondas, isletas, etc. que no están descritos en esta relación.    A través del Portal de Visualizaciones ' Visualiza Madrid con Datos Abiertos' , el Ayuntamiento de Madrid pone a tu disposición una visualización acerca del Catálogo de Datos Abiertos del Ayuntamiento de Madrid, en la que se muestran datos sobre los principales parques y jardines municipales.          Acceder a la visualización       Fuente:     www.madrid.es","mar, 11 mar 2014 23:00:00 GMT+0000","vie, 22 ago 2025 22:55:39 GMT+0000",http://datos.gob.es/recurso/sector-publico/org/Organismo/L01280796
https://datos.madrid.es/egob/catalogo/201105-0-informacion-turismo,Puntos de información turística,"Recopila información de los puntos de información turística de la ciudad de Madrid que están publicados en el portal institucional madrid.es.   En la información de cada espacio, incluye información (si está disponible) sobre:     el horario   los equipamientos de que dispone y/o los servicios que presta   su dirección completa (incluyendo calle,  distrito, barrio, código postal y coordenadas geográficas)   los medios de transporte más cercanos disponibles (Bus, metro, Bicimad y Renfe)   teléfono   el correo electrónico   la dirección web donde está publicada en madrid.es para su consulta en un formato más amigable.            Importante: La información proporcionada puede no ser exhaustiva, es la disponible actualmente en madrid.es.    Fuente:  www.madrid.es .","mar, 11 mar 2014 23:00:00 GMT+0000","vie, 22 ago 2025 22:55:39 GMT+0000",http://datos.gob.es/recurso/sector-publico/org/Organismo/L01280796
https://datos.madrid.es/egob/catalogo/200284-0-puntos-limpios-fijos,Puntos limpios fijos,"Información de datos, ubicación, características,  horarios , coordenadas de localización y servicios de los distintos  puntos limpios fijos municipales  de la ciudad de Madrid.    En la ciudad de Madrid, aparte de estos puntos, también existen los siguientes para favorecer el reciclaje:        Puntos limpios móviles       Puntos limpios de proximidad       Contenedores de ropa autorizados del Ayuntamiento de Madrid       Contenedores de aceite vegetal usado       Contenedores de pilas en marquesinas de autobús       Contenedores de papel-cartón, vidrio, envases, orgánica y restos        También es muy interesante este otro conjunto de datos relacionado:        Tipos de residuos y dónde depositarlos       Revise horarios y dias disponibles, antes de acercarse a uno de ellos.   También puede  consultar la relación existente  en la web municipal  www.madrid.es  para ver la ficha asociada a cada instalación.    Fuente:  www.madrid.es .","mar, 11 mar 2014 23:00:00 GMT+0000","vie, 22 ago 2025 22:55:39 GMT+0000",http://datos.gob.es/recurso/sector-publico/org/Organismo/L01280796
https://datos.madrid.es/egob/catalogo/202311-0-colegios-publicos,Colegios Públicos de Madrid,"Recopila información de los colegios públicos de la ciudad de Madrid publicados en el portal institucional Madrid.es   En la información de cada espacio, incluye información (si está disponible) sobre:     el horario   los equipamientos de que dispone y/o los servicios que presta   su dirección completa (incluyendo calle,  distrito, barrio, código postal y coordenadas geográficas)   los medios de transporte más cercanos disponibles (Bus, metro, Bicimad y Renfe)   teléfono   el correo electrónico   la dirección web donde está publicada en madrid.es para su consulta en un formato más amigable.            Importante: La información proporcionada puede no ser exhaustiva, es la disponible actualmente en madrid.es.         Fuente:  www.madrid.es","mar, 11 mar 2014 23:00:00 GMT+0000","vie, 22 ago 2025 22:55:37 GMT+0000",http://datos.gob.es/recurso/sector-publico/org/Organismo/L01280796
https://datos.madrid.es/egob/catalogo/202318-0-escuelas-infantiles,Escuelas Infantiles Municipales,"Las escuelas infantiles municipales son centros de titularidad del Ayuntamiento de Madrid, integrados en una red municipal propia, cuyo objetivo fundamental es mejorar la calidad de la educación en la primera infancia.   Son centros dirigidos a alumnas y alumnos del primer ciclo de Educación Infantil (niñas y niños entre los 4 meses y 3 años de edad)    Calendario escolar y horario:      Abiertos once meses al año. Cerrado el mes de agosto.   El horario general es de 9:00 a 16:00 horas.   Posibilidad de horario ampliado desde las 7:30 hasta las 17:30 horas.     Se proporcionan datos de:     ubicación   contacto   transporte   coordenadas para su localización sobre plano   servicios que se proporcionan     También puede  consultar la relación existente  en la web municipal  www.madrid.es  para ver la ficha asociada a cada centro.   A través del Portal de Visualizaciones ' Visualiza Madrid con Datos Abiertos' , el Ayuntamiento de Madrid pone a tu disposición una visualización acerca del Catálogo de Datos Abiertos del Ayuntamiento de Madrid, en la que se muestran datos sobre Escuelas Infantiles Municipales.           Acceder a la visualización      Fuente:  www.madrid.es","mar, 11 mar 2014 23:00:00 GMT+0000","vie, 22 ago 2025 22:55:37 GMT+0000",http://datos.gob.es/recurso/sector-publico/org/Organismo/L01280796
https://datos.madrid.es/egob/catalogo/202162-0-instalaciones-accesibles-municip,Instalaciones accesibles municipales,"Recopila información de todas aquellas instalaciones accesibles municipales de la ciudad y que están publicadas en el portal institucional madrid.es.    En la información de cada espacio, incluye información (si está disponible) sobre:     el horario   los equipamientos de que dispone y/o los servicios que presta   su dirección completa (incluyendo calle,  distrito, barrio, código postal y coordenadas geográficas)   los medios de transporte más cercanos disponibles (Bus, metro, Bicimad y Renfe)   teléfono   el correo electrónico   la dirección web donde está publicada en madrid.es para su consulta en un formato más amigable.            Importante: La información proporcionada puede no ser exhaustiva, es la disponible actualmente en madrid.es.     Fuente:  www.madrid.es","mar, 11 mar 2014 23:00:00 GMT+0000","vie, 22 ago 2025 22:55:37 GMT+0000",http://datos.gob.es/recurso/sector-publico/org/Organismo/L01280796
https://datos.madrid.es/egob/catalogo/202180-0-instalaciones-accesibles-no-muni,Instalaciones accesibles no municipales,"Recopila información de todas aquellas instalaciones accesibles no municipales de la ciudad de las que posee conocimiento expreso el Ayuntamiento de Madrid y que están publicadas en el portal institucional madrid.es.    Incluye, entre otras, información sobre:   -          Ministerios   -          Oficinas de correos   -          Centros de enseñanza y universidades   -          Centros de día y residenciales   -          Museos   -          Espacios de ocio       En la información de cada espacio, incluye información (si está disponible) sobre:     el horario   los equipamientos de que dispone y/o los servicios que presta   su dirección completa (incluyendo calle,  distrito, barrio, código postal y coordenadas geográficas)   los medios de transporte más cercanos disponibles (Bus, metro, Bicimad y Renfe)   teléfono   el correo electrónico   la dirección web donde está publicada en madrid.es para su consulta en un formato más amigable.            Importante: La información proporcionada puede no ser exhaustiva, es la disponible actualmente en madrid.es.     Fuente:  www.madrid.es","mar, 11 mar 2014 23:00:00 GMT+0000","vie, 22 ago 2025 22:55:37 GMT+0000",http://datos.gob.es/recurso/sector-publico/org/Organismo/L01280796
https://datos.madrid.es/egob/catalogo/201544-0-centros-salud,Madrid Salud. Relación de centros municipales,"Centros de Salud Municipales   Centros de Atención a Drogodependencias   Centros especializados   Centros monográficos     Datos de ubicación, transporte, contacto, horario y servicios. Referencias a Barrios y Distritos de ubicación del centro y su área de influencia de servicios.       Fuente:     www.madrid.es","mar, 11 mar 2014 23:00:00 GMT+0000","vie, 22 ago 2025 22:55:37 GMT+0000",http://datos.gob.es/recurso/sector-publico/org/Organismo/L01280796
https://datos.madrid.es/egob/catalogo/202105-0-mercadillos,Mercadillos en la vía pública,"Mercadillos municipales en vía pública. Ubicación, fechas y horario de celebración.   A través del Portal de Visualizaciones ' Visualiza Madrid con Datos Abiertos' , el Ayuntamiento de Madrid pone a tu disposición una visualización acerca del Catálogo de Datos Abiertos del Ayuntamiento de Madrid, en la que se muestran datos sobre Mercadillos en la vía pública.          Acceder a la visualización            Fuente:     www.madrid.es","mar, 11 mar 2014 23:00:00 GMT+0000","vie, 22 ago 2025 22:55:37 GMT+0000",http://datos.gob.es/recurso/sector-publico/org/Organismo/L01280796
