id,title,description,issued,modified,publisher
https://datos.icane.es/dataset/38dcc408-8b5f-4530-af80-ea53b7e05eb2,Cinematografía,Cinematografía,"vie, 14 mar 2025 07:47:06 GMT+0000","vie, 22 ago 2025 11:15:22 GMT+0000",http://datos.gob.es/recurso/sector-publico/org/Organismo/A06004074
https://datos.icane.es/dataset/545cc8bd-33dd-4029-a76a-d7a25654ae3b,Conflictividad laboral: huelgas,Conflictividad laboral: huelgas,"vie, 14 mar 2025 07:47:07 GMT+0000","vie, 22 ago 2025 11:15:22 GMT+0000",http://datos.gob.es/recurso/sector-publico/org/Organismo/A06004074
https://datos.icane.es/dataset/f31247d6-727f-465d-8c19-872ababecd26,Cuota láctea,Cuota láctea,"vie, 14 mar 2025 07:47:07 GMT+0000","vie, 22 ago 2025 11:15:22 GMT+0000",http://datos.gob.es/recurso/sector-publico/org/Organismo/A06004074
https://datos.icane.es/dataset/063346ef-0af0-41b5-9092-8db04cfab4f5,Cuota láctea,Cuota láctea,"vie, 14 mar 2025 07:47:07 GMT+0000","vie, 22 ago 2025 11:15:22 GMT+0000",http://datos.gob.es/recurso/sector-publico/org/Organismo/A06004074
https://datos.icane.es/dataset/87742e61-ad86-4b66-9dc5-aaf6ac80434c,Calidad higiénica de la leche,Calidad higiénica de la leche,"vie, 14 mar 2025 07:47:06 GMT+0000","vie, 22 ago 2025 11:15:21 GMT+0000",http://datos.gob.es/recurso/sector-publico/org/Organismo/A06004074
https://datos.icane.es/dataset/9f2e0057-9585-4dbf-a3eb-5326e5acdcd5,Estadísticas del Consejo General del Poder Judicial,Estadísticas del Consejo General del Poder judicial,"vie, 14 mar 2025 07:47:06 GMT+0000","vie, 22 ago 2025 11:15:21 GMT+0000",http://datos.gob.es/recurso/sector-publico/org/Organismo/A06004074
https://datos.icane.es/dataset/303f681a-d455-4322-afa8-bace6bf11d39,Estadísticas del Consejo General del Poder Judicial,Estadísticas judiciales,"vie, 14 mar 2025 07:45:47 GMT+0000","vie, 22 ago 2025 11:15:21 GMT+0000",http://datos.gob.es/recurso/sector-publico/org/Organismo/A06004074
https://datos.icane.es/dataset/bbc8a0ee-da24-4f02-8891-b9d56a5074e3,Consumo de gas natural,Consumo de gas natural,"vie, 14 mar 2025 07:45:46 GMT+0000","vie, 22 ago 2025 11:15:20 GMT+0000",http://datos.gob.es/recurso/sector-publico/org/Organismo/A06004074
https://datos.icane.es/dataset/1b980ff8-db5b-4553-9696-b237069fe940,Censo de Población y Viviendas,Censo de Población y Viviendas,"vie, 14 mar 2025 07:45:45 GMT+0000","vie, 22 ago 2025 11:15:18 GMT+0000",http://datos.gob.es/recurso/sector-publico/org/Organismo/A06004074
https://datos.icane.es/dataset/5aa9b0ca-429a-4dfd-8f9a-111198568265,Censo de Población y Viviendas,Censos de Población y Viviendas,"vie, 14 mar 2025 07:45:43 GMT+0000","vie, 22 ago 2025 11:15:15 GMT+0000",http://datos.gob.es/recurso/sector-publico/org/Organismo/A06004074
https://datos.icane.es/dataset/5df971b7-a4c6-4034-92bd-e22cacdac492,Encuesta de Consumos Energéticos,Encuesta de Consumos Energéticos,"vie, 14 mar 2025 07:45:42 GMT+0000","vie, 22 ago 2025 11:15:15 GMT+0000",http://datos.gob.es/recurso/sector-publico/org/Organismo/A06004074
https://datos.icane.es/dataset/3ac83a18-bb57-489c-a28a-dcf892aa079c,Construcción de edificios (licencias municipales de obra),Construcción de edificios (licencias municipales de obra),"vie, 14 mar 2025 07:45:42 GMT+0000","vie, 22 ago 2025 11:15:14 GMT+0000",http://datos.gob.es/recurso/sector-publico/org/Organismo/A06004074
https://datos.icane.es/dataset/10abfd7a-c2fd-42a0-afa6-a70029c0af9c,Construcción de edificios (licencias municipales de obra),Construcción de edificios (licencias municipales de obra),"vie, 14 mar 2025 07:45:42 GMT+0000","vie, 22 ago 2025 11:15:14 GMT+0000",http://datos.gob.es/recurso/sector-publico/org/Organismo/A06004074
https://datos.icane.es/dataset/f9df8752-0c7c-4c78-ab5d-668c0ea349f3,Censo Agrario,Censo agrario,"vie, 14 mar 2025 07:45:39 GMT+0000","vie, 22 ago 2025 11:15:09 GMT+0000",http://datos.gob.es/recurso/sector-publico/org/Organismo/A06004074
https://datos.icane.es/dataset/c6c3982c-a2db-4f18-9957-c68d33489384,Censo Agrario,Censo agrario,"vie, 14 mar 2025 07:45:39 GMT+0000","vie, 22 ago 2025 11:15:08 GMT+0000",http://datos.gob.es/recurso/sector-publico/org/Organismo/A06004074
https://datos.icane.es/dataset/c07734f3-d728-4b55-8600-2373ccbc66a8,Estadísticas de bibliotecas,Estadísticas de bibliotecas,"vie, 14 mar 2025 07:45:38 GMT+0000","vie, 22 ago 2025 11:15:07 GMT+0000",http://datos.gob.es/recurso/sector-publico/org/Organismo/A06004074
https://datos.icane.es/dataset/7556a7c4-f370-4480-b3c8-485eb55b2cbc,Juegos de azar,Juegos de azar,"vie, 14 mar 2025 07:45:37 GMT+0000","vie, 22 ago 2025 11:15:07 GMT+0000",http://datos.gob.es/recurso/sector-publico/org/Organismo/A06004074
https://datos.icane.es/dataset/da236d01-a376-4300-b30a-4b94acf51837,Aprovechamientos vecinales plan de utilidad pública,Aprovechamientos vecinales plan de utilidad pública,"vie, 14 mar 2025 07:45:37 GMT+0000","vie, 22 ago 2025 11:15:06 GMT+0000",http://datos.gob.es/recurso/sector-publico/org/Organismo/A06004074
https://datos.icane.es/dataset/06d86aa7-dc92-422d-bf17-db1026403e21,Accidentes de trabajo y enfermedades profesionales,Accidentes de trabajo y enfermedades profesionales,"vie, 14 mar 2025 07:45:36 GMT+0000","vie, 22 ago 2025 11:15:05 GMT+0000",http://datos.gob.es/recurso/sector-publico/org/Organismo/A06004074
https://datos.icane.es/dataset/4bc86715-997f-4846-aebb-89b9ce4f0869,Adjudicaciones de Obras del Grupo MITMA,Adjudicaciones de obras del Grupo MITMA,"vie, 14 mar 2025 07:45:36 GMT+0000","vie, 22 ago 2025 11:15:05 GMT+0000",http://datos.gob.es/recurso/sector-publico/org/Organismo/A06004074
https://datos.icane.es/dataset/23ab7765-e252-4411-ab9c-8af5b3a0215e,Asuntos judiciales sociales,Asuntos judiciales sociales,"vie, 14 mar 2025 07:45:36 GMT+0000","vie, 22 ago 2025 11:15:04 GMT+0000",http://datos.gob.es/recurso/sector-publico/org/Organismo/A06004074
https://datos.icane.es/dataset/d4578d2e-5180-4daf-9d1d-5be3533242db,Estadística de arrendamientos urbanos,Estadística de arrendamientos urbanos,"vie, 14 mar 2025 07:45:35 GMT+0000","vie, 22 ago 2025 11:15:04 GMT+0000",http://datos.gob.es/recurso/sector-publico/org/Organismo/A06004074
https://datos.icane.es/dataset/64638786-0261-4283-a7c6-b7a0ad46d6f1,Artes escénicas,Artes escénicas,"vie, 14 mar 2025 07:45:34 GMT+0000","vie, 22 ago 2025 11:15:03 GMT+0000",http://datos.gob.es/recurso/sector-publico/org/Organismo/A06004074
https://datos.icane.es/dataset/912c34f6-f74a-4054-bf91-5f403a245bb0,Artes musicales,Artes musicales,"vie, 14 mar 2025 07:45:35 GMT+0000","vie, 22 ago 2025 11:15:03 GMT+0000",http://datos.gob.es/recurso/sector-publico/org/Organismo/A06004074
https://datos.madrid.es/egob/catalogo/300618-0-ejecucion-presupuestaria-2024,Presupuestos. Ejecución mensual ejercicio en curso,"Este conjunto de datos ofrece información sobre la ejecución mensual del Presupuesto del Ayuntamiento de Madrid y sus Organismos Autónomos durante el ejercicio actual.   Los datos ofrecidos se refieren al presupuesto de ingresos, al presupuesto de gastos, así como a los proyectos de inversión que se están ejecutando durante el ejercicio.   En relación con el presupuesto de ingresos, la información se muestra atendiendo a la clasificación orgánica (centro) y económica (subconcepto). Para cada una de ellas se ofrece el importe previsto inicialmente, las modificaciones que han existido a lo largo del ejercicio, la previsión definitiva, los derechos reconocidos y su recaudación.   Por lo que se refiere al presupuesto de gastos, los datos también se ofrecen de acuerdo con la triple clasificación orgánica (centro y sección), funcional (programa) y económica (subconcepto) de las distintas aplicaciones presupuestarias de gasto. En este caso se muestra para cada una de ellas el crédito inicial, sus modificaciones, el crédito definitivo, el crédito autorizado, el crédito dispuesto y las obligaciones reconocidas.   Por su parte, los datos sobre inversiones contienen para cada uno de los proyectos de inversión que se ejecutan, entre otros, el código y título del proyecto, la línea y sublínea de inversión en que se clasifica el proyecto, el distrito en el que se localiza, la aplicación presupuestaria (centro y sección, programa y subconcepto) donde se encuentra su crédito, así como el crédito inicial, sus modificaciones, el crédito definitivo, el crédito autorizado, el crédito dispuesto, las obligaciones reconocidas y los pagos realizados en cada uno de ellos.   Por último, existen unos ficheros donde se muestran las eliminaciones que se deben practicar en el presupuesto de ingresos y en el presupuesto de gastos para poder obtener la información consolidada del Ayuntamiento de Madrid con sus Organismos Autónomos.   Es preciso señalar que los importes que se muestran en todos los ficheros son nominales.   Esta información se actualiza mensualmente sobre el día 15 del mes, obteniéndose en ese momento la información del mes anterior (por ejemplo, sobre el 15 de febrero, se obtendría los datos del mes de enero). Asimismo, es preciso indicar que la información del último mes mostrado consolida la información de los meses anteriores, es decir, la ejecución presupuestaria de noviembre, por ejemplo, recoge la ejecución de los primeros once meses del año, y no solo los datos de noviembre.   A través de la web Presupuestosabiertosmadrid.es se pueden visualizar los datos de ejecución mensual consolidados desde el ejercicio 2011, tanto en términos nominales como reales, esto es, ajustados a la inflación.            Acceder a la visualización Presupuestos Abiertos    En el apartado de Documentación asociada se puede encontrar un documento de estructura donde se describe la información que contienen los diferentes ficheros que pueden ser descargados y un documento glosario de términos que permita facilitar la comprensión de los datos.","jue, 20 feb 2025 08:05:01 GMT+0000","vie, 22 ago 2025 10:27:54 GMT+0000",http://datos.gob.es/recurso/sector-publico/org/Organismo/L01280796
urn:ine:es:TABLA:T3:548:37808,Measurement of Large Company Daily Retail Trade. CDMGE (API identifier: 37808) | Medición del comercio diario al por menor de grandes empresas. CDMGE (Identificador API: 37808),"Tabla de Estadística Experimental.
Medición del comercio diario al por menor de grandes empresas. Nacional | Table of Experimental Statistics.
Measurement of Large Company Daily Retail Trade. National. Daily retail trade of large companies","jue, 17 sep 2020 09:00:00 GMT+0000","vie, 22 ago 2025 10:00:00 GMT+0000",http://datos.gob.es/recurso/sector-publico/org/Organismo/EA0010587
urn:ine:es:TABLA:T3:1:7904,Coeficientes de variación de viajeros y pernoctaciones. EOH (Identificador API: 7904) | Variation coefficient of guests and overnight stays. EOH (API identifier: 7904),"Tabla de INEbase
Coeficientes de variación de viajeros y pernoctaciones. Mensual. Nacional. Encuesta de Ocupación Hotelera | Table of INEBase
Variation coefficient of guests and overnight stays. Monthly. National. Hotel Occupancy Survey","vie, 15 sep 2023 11:00:00 GMT+0000","vie, 22 ago 2025 09:00:00 GMT+0000",http://datos.gob.es/recurso/sector-publico/org/Organismo/EA0010587
urn:ine:es:TABLA:T3:1:36570,Coyuntura turística hotelera: pernoctaciones en establecimientos hoteleros. EOH (Identificador API: 36570) | Hotel tourism situation: overnight stays in hotel establishments. EOH (API identifier: 36570),"Tabla de INEbaseCopia de la 2074 con el Acumualdo en lo que va de año para graficarlo
Coyuntura turística hotelera: pernoctaciones en establecimientos hoteleros. Mensual. Provincias. Encuesta de Ocupación Hotelera | Table of INEBaseCopia de la 2074 con el Acumualdo en lo que va de año para graficarlo
Hotel tourism situation: overnight stays in hotel establishments. Monthly. Provinces. Hotel Occupancy Survey","vie, 22 feb 2019 09:00:00 GMT+0000","vie, 22 ago 2025 09:00:00 GMT+0000",http://datos.gob.es/recurso/sector-publico/org/Organismo/EA0010587
urn:ine:es:TABLA:T3:1:2069,Distribución porcentual de viajeros y pernoctaciones en cada provincia según comunidad autónoma de procedencia. EOH (Identificador API: 2069) | Porcentaul distribution of travellers and overnight stays in each province by Autonomous Community of origin. EOH (API identifier: 2069),"Tabla de INEbase
Distribución porcentual de viajeros y pernoctaciones en cada provincia según comunidad autónoma de procedencia. Mensual. Provincias. Encuesta de Ocupación Hotelera | Table of INEBase
Porcentaul distribution of travellers and overnight stays in each province by Autonomous Community of origin. Monthly. Provinces. Hotel Occupancy Survey","vie, 15 sep 2023 11:00:00 GMT+0000","vie, 22 ago 2025 09:00:00 GMT+0000",http://datos.gob.es/recurso/sector-publico/org/Organismo/EA0010587
urn:ine:es:TABLA:T3:1:75198,"Establecimientos, plazas estimadas, grados de ocupación y personal empleado por puntos turísticos. EOH (Identificador API: 75198) | Establishments, bed-places, occupancy rate and employed personnel by tourist site. EOH (API identifier: 75198)","Tabla de INEbase
Establecimientos, plazas estimadas, grados de ocupación y personal empleado por puntos turísticos. Mensual. Nacional. Encuesta de Ocupación Hotelera | Table of INEBase
Establishments, bed-places, occupancy rate and employed personnel by tourist site. Monthly. National. Hotel Occupancy Survey","mar, 25 feb 2025 09:00:00 GMT+0000","vie, 22 ago 2025 09:00:00 GMT+0000",http://datos.gob.es/recurso/sector-publico/org/Organismo/EA0010587
urn:ine:es:TABLA:T3:1:2076,"Establecimientos, plazas estimadas, grados de ocupación y personal empleado por puntos turísticos. EOH (Identificador API: 2076) | Establishments, bed-places, occupancy rate and employed personnel by tourist site. EOH (API identifier: 2076)","Tabla de INEbase
Establecimientos, plazas estimadas, grados de ocupación y personal empleado por puntos turísticos. Mensual. Nacional. Encuesta de Ocupación Hotelera | Table of INEBase
Establishments, bed-places, occupancy rate and employed personnel by tourist site. Monthly. National. Hotel Occupancy Survey","vie, 15 sep 2023 11:00:00 GMT+0000","vie, 22 ago 2025 09:00:00 GMT+0000",http://datos.gob.es/recurso/sector-publico/org/Organismo/EA0010587
urn:ine:es:TABLA:T3:1:2013,"Establecimientos, plazas estimadas, grados de ocupación y personal empleado por zonas turísticas. EOH (Identificador API: 2013) | Establishments, bed-places, occupancy rate and employed personnel by tourist area. EOH (API identifier: 2013)","Tabla de INEbase
Establecimientos, plazas estimadas, grados de ocupación y personal empleado por zonas turísticas. Mensual. Nacional. Encuesta de Ocupación Hotelera | Table of INEBase
Establishments, bed-places, occupancy rate and employed personnel by tourist area. Monthly. National. Hotel Occupancy Survey","vie, 15 sep 2023 11:00:00 GMT+0000","vie, 22 ago 2025 09:00:00 GMT+0000",http://datos.gob.es/recurso/sector-publico/org/Organismo/EA0010587
urn:ine:es:TABLA:T3:1:2011,"Establecimientos, plazas, grados de ocupación y personal empleado por categorías. EOH (Identificador API: 2011) | Establishments, bed-places, occupancy rate and employed personnel by category. EOH (API identifier: 2011)","Tabla de INEbase
Establecimientos, plazas, grados de ocupación y personal empleado por categorías. Mensual. Nacional. Encuesta de Ocupación Hotelera | Table of INEBase
Establishments, bed-places, occupancy rate and employed personnel by category. Monthly. National. Hotel Occupancy Survey","jue, 23 dic 2010 09:00:00 GMT+0000","vie, 22 ago 2025 09:00:00 GMT+0000",http://datos.gob.es/recurso/sector-publico/org/Organismo/EA0010587
urn:ine:es:TABLA:T3:1:2066,"Establecimientos, plazas, grados de ocupación y personal empleado por comunidades autónomas y provincias. EOH (Identificador API: 2066) | Establishments, bed-places, occupancy rate and employed personnel by Autonomous Community and Province. EOH (API identifier: 2066)","Tabla de INEbase
Establecimientos, plazas, grados de ocupación y personal empleado por comunidades autónomas y provincias. Mensual. Encuesta de Ocupación Hotelera | Table of INEBase
Establishments, bed-places, occupancy rate and employed personnel by Autonomous Community and Province. Monthly. Provinces. Hotel Occupancy Survey","vie, 15 sep 2023 11:00:00 GMT+0000","vie, 22 ago 2025 09:00:00 GMT+0000",http://datos.gob.es/recurso/sector-publico/org/Organismo/EA0010587
urn:ine:es:TABLA:T3:1:2014,Average stay by categories. EOH (API identifier: 2014) | Estancia media por categorías. EOH (Identificador API: 2014),"Tabla de INEbase
Estancia media por categorías. Mensual. Nacional. Encuesta de Ocupación Hotelera | Table of INEBase
Average stay by categories. Monthly. National. Hotel Occupancy Survey","jue, 23 dic 2010 09:00:00 GMT+0000","vie, 22 ago 2025 09:00:00 GMT+0000",http://datos.gob.es/recurso/sector-publico/org/Organismo/EA0010587
urn:ine:es:TABLA:T3:1:2065,Average stay by Autonomous Communities and provinces. EOH (API identifier: 2065) | Estancia media por comunidades autónomas y provincias. EOH (Identificador API: 2065),"Tabla de INEbase
Estancia media por comunidades autónomas y provincias. Mensual. Encuesta de Ocupación Hotelera | Table of INEBase
Average stay by Autonomous Communities and provinces. Monthly. Hotel Occupancy Survey","jue, 23 dic 2010 09:00:00 GMT+0000","vie, 22 ago 2025 09:00:00 GMT+0000",http://datos.gob.es/recurso/sector-publico/org/Organismo/EA0010587
urn:ine:es:TABLA:T3:1:2077,Average stay by tourist sites. EOH (API identifier: 2077) | Estancia media por puntos turísticos. EOH (Identificador API: 2077),"Tabla de INEbase
Estancia media por puntos turísticos. Mensual. Nacional. Encuesta de Ocupación Hotelera | Table of INEBase
Average stay by tourist sites. Monthly. National. Hotel Occupancy Survey","vie, 15 sep 2023 11:00:00 GMT+0000","vie, 22 ago 2025 09:00:00 GMT+0000",http://datos.gob.es/recurso/sector-publico/org/Organismo/EA0010587
urn:ine:es:TABLA:T3:1:2040,Average stay by tourist areas. EOH (API identifier: 2040) | Estancia media por zonas turísticas. EOH (Identificador API: 2040),"Tabla de INEbase
Estancia media por zonas turísticas. Mensual. Nacional. Encuesta de Ocupación Hotelera | Table of INEBase
Average stay by tourist areas. Monthly. National. Hotel Occupancy Survey","vie, 15 sep 2023 11:00:00 GMT+0000","vie, 22 ago 2025 09:00:00 GMT+0000",http://datos.gob.es/recurso/sector-publico/org/Organismo/EA0010587
urn:ine:es:TABLA:T3:1:13874,Hotel Price Index (HPI): Coefficient of variation of the national overall index. IPH (API identifier: 13874) | Índices de precios hoteleros. Coeficiente de variación del índice general nacional. IPH (Identificador API: 13874),"Tabla de INEbase
Índices de precios hoteleros. Coeficiente de variación del índice general nacional. Mensual. Índice de Precios Hoteleros | Table of INEBase
Hotel Price Index (HPI): Coefficient of variation of the national overall index. Monthly","lun, 24 feb 2014 09:00:00 GMT+0000","vie, 22 ago 2025 09:00:00 GMT+0000",http://datos.gob.es/recurso/sector-publico/org/Organismo/EA0010587
urn:ine:es:TABLA:T3:1:12157,"Hotel price index, interannual variation rates and indices by categories. IPH (API identifier: 12157) | Índices de precios hoteleros, índices y tasas de variación interanual por categorías. IPH (Identificador API: 12157)","Tabla de INEbase
Índices de precios hoteleros, índices y tasas de variación interanual por categorías. Mensual. Nacional. Índice de Precios Hoteleros | Table of INEBase
Hotel price index, interannual variation rates and indices by categories. Monthly. National","jue, 23 dic 2010 09:00:00 GMT+0000","vie, 22 ago 2025 09:00:00 GMT+0000",http://datos.gob.es/recurso/sector-publico/org/Organismo/EA0010587
urn:ine:es:TABLA:T3:1:12156,"Hotel price index, interannual variation rates and indices by Autonomous Communities. IPH (API identifier: 12156) | Índices de precios hoteleros, índices y tasas de variación interanual por comunidades autónomas. IPH (Identificador API: 12156)","Tabla de INEbase
Índices de precios hoteleros, índices y tasas de variación interanual por comunidades autónomas. Mensual. Comunidades y Ciudades Autónomas. Índice de Precios Hoteleros | Table of INEBase
Hotel price index, interannual variation rates and indices by Autonomous Communities. Monthly. Autonomous Communities and Cities","jue, 23 dic 2010 09:00:00 GMT+0000","vie, 22 ago 2025 09:00:00 GMT+0000",http://datos.gob.es/recurso/sector-publico/org/Organismo/EA0010587
urn:ine:es:TABLA:T3:1:2057,Ingresos por habitación disponible (RevPAR) por comunidades autónomas y provincias. IRSH (Identificador API: 2057) | Revenue Per Available Room (RevPar) bt Autonomous Communities and provinces. IRSH (API identifier: 2057),"Tabla de INEbase
Ingresos por habitación disponible (RevPAR) por comunidades autónomas y provincias. Mensual. Indicadores de Rentabilidad del Sector Hotelero | Table of INEBase
Revenue Per Available Room (RevPar) bt Autonomous Communities and provinces. Monthly. Indicators on the Profitability of the Hotel Sector","jue, 23 dic 2010 09:00:00 GMT+0000","vie, 22 ago 2025 09:00:00 GMT+0000",http://datos.gob.es/recurso/sector-publico/org/Organismo/EA0010587
urn:ine:es:TABLA:T3:1:2056,Ingresos por habitación disponible (RevPAR) Nacional y desglose por categorías. IRSH (Identificador API: 2056) | Revenue per available room (RevPar) National and breakdown by categories. IRSH (API identifier: 2056),"Tabla de INEbase
Ingresos por habitación disponible (RevPAR) Nacional y desglose por categorías. Mensual. Indicadores de Rentabilidad del Sector Hotelero | Table of INEBase
Revenue per available room (RevPar) National and breakdown by categories. Monthly. Indicators on the Profitability of the Hotel Sector","jue, 23 dic 2010 09:00:00 GMT+0000","vie, 22 ago 2025 09:00:00 GMT+0000",http://datos.gob.es/recurso/sector-publico/org/Organismo/EA0010587
urn:ine:es:TABLA:T3:1:46301,Ingresos por habitación disponible (RevPAR) por puntos turísticos. IRSH (Identificador API: 46301) | Revenue per available room (RevPAR) by tourist sites. IRSH (API identifier: 46301),"Tabla de INEbase
Ingresos por habitación disponible (RevPAR) por puntos turísticos. Mensual. Municipios. Indicadores de Rentabilidad del Sector Hotelero | Table of INEBase
Revenue per available room (RevPAR) by tourist sites. Monthly. Municipalities. Indicators on the Profitability of the Hotel Sector","mié, 24 feb 2021 09:00:00 GMT+0000","vie, 22 ago 2025 09:00:00 GMT+0000",http://datos.gob.es/recurso/sector-publico/org/Organismo/EA0010587
urn:ine:es:TABLA:T3:1:46300,Ingresos por habitación disponible (RevPAR) por zonas turísticas. IRSH (Identificador API: 46300) | Revenue per available room (RevPAR) by tourist areas. IRSH (API identifier: 46300),"Tabla de INEbase
Ingresos por habitación disponible (RevPAR) por zonas turísticas. Mensual. Nacional. Indicadores de Rentabilidad del Sector Hotelero | Table of INEBase
Revenue per available room (RevPAR) by tourist areas. Monthly. National. Indicators on the Profitability of the Hotel Sector","mié, 24 feb 2021 09:00:00 GMT+0000","vie, 22 ago 2025 09:00:00 GMT+0000",http://datos.gob.es/recurso/sector-publico/org/Organismo/EA0010587
urn:ine:es:TABLA:T3:1:46298,Average daily rate (ADR) breakdown by tourist sites. IRSH (API identifier: 46298) | Tarifa media diaria (ADR)  desglose por puntos turísticos. IRSH (Identificador API: 46298),"Tabla de INEbase
Tarifa media diaria (ADR)  desglose por puntos turísticos. Mensual. Municipios. Indicadores de Rentabilidad del Sector Hotelero | Table of INEBase
Average daily rate (ADR) breakdown by tourist sites. Monthly. Municipalities. Indicators on the Profitability of the Hotel Sector","mié, 24 feb 2021 09:00:00 GMT+0000","vie, 22 ago 2025 09:00:00 GMT+0000",http://datos.gob.es/recurso/sector-publico/org/Organismo/EA0010587
urn:ine:es:TABLA:T3:1:46297,Average daily rate (ADR) breakdown by tourist areas. IRSH (API identifier: 46297) | Tarifa media diaria (ADR)  desglose por zonas turísticas. IRSH (Identificador API: 46297),"Tabla de INEbase
Tarifa media diaria (ADR)  desglose por zonas turísticas. Mensual. Nacional. Indicadores de Rentabilidad del Sector Hotelero | Table of INEBase
Average daily rate (ADR) breakdown by tourist areas. Monthly. National. Indicators on the Profitability of the Hotel Sector","mié, 24 feb 2021 09:00:00 GMT+0000","vie, 22 ago 2025 09:00:00 GMT+0000",http://datos.gob.es/recurso/sector-publico/org/Organismo/EA0010587
urn:ine:es:TABLA:T3:1:2059,Average Daily Rate (ADR)  by Autonomous Communities and provinces. IRSH (API identifier: 2059) | Tarifa media diaria (ADR) por comunidades autónomas y provincias. IRSH (Identificador API: 2059),"Tabla de INEbase
Tarifa media diaria (ADR) por comunidades autónomas y provincias. Mensual. Indicadores de Rentabilidad del Sector Hotelero | Table of INEBase
Average Daily Rate (ADR)  by Autonomous Communities and provinces. Monthly. Indicators on the Profitability of the Hotel Sector","jue, 23 dic 2010 09:00:00 GMT+0000","vie, 22 ago 2025 09:00:00 GMT+0000",http://datos.gob.es/recurso/sector-publico/org/Organismo/EA0010587
urn:ine:es:TABLA:T3:1:2058,Average Daily Rate (ADR) National and breakdown by categories. IRSH (API identifier: 2058) | Tarifa media diaria (ADR) Nacional y desglose por categorías. IRSH (Identificador API: 2058),"Tabla de INEbase
Tarifa media diaria (ADR) Nacional y desglose por categorías. Mensual. Indicadores de Rentabilidad del Sector Hotelero | Table of INEBase
Average Daily Rate (ADR) National and breakdown by categories. Monthly. Indicators on the Profitability of the Hotel Sector","jue, 23 dic 2010 09:00:00 GMT+0000","vie, 22 ago 2025 09:00:00 GMT+0000",http://datos.gob.es/recurso/sector-publico/org/Organismo/EA0010587
